{"calculation":{"denominatorChurn":1058,"metricId":"M4_DEVELOPER_CHURN_SHARE","metricValuePpm":307183,"metricVersion":"1.0.0","numeratorChurn":325,"scale":1000000},"evidenceArtifact":{"mediaType":"application/vnd.git.bundle","sha256":"a41205eff782ce4af65f345e0afb97f16fd8677af215c7bdd06f460ce9602272","storagePersistence":"LOCAL_POC","storageReference":"artifacts/urllib3_W03.git.bundle"},"extraction":{"binaryFileChanges":0,"excludedBotChurn":18,"excludedBotCommits":2,"excludedBotIdentities":1,"humanAdded":703,"humanChurn":1058,"humanCommits":14,"humanDeleted":355,"humanDevelopers":9,"identitySource":"%ae","mergeCommitsIncluded":false,"vcs":"git"},"policy":{"analysisPolicyHash":"4e81843340041da45a13ebb742a0c5fdfebdf6c8f5e64a7d6629f58990b287a4","policyId":"M4_DEVELOPER_CHURN_SHARE_POLICY","policyVersion":"1.0.0"},"project":{"projectId":"urllib3","repositoryUrl":"https://github.com/urllib3/urllib3"},"schemaId":"M4_EVIDENCE_MANIFEST","schemaVersion":"1.0.0","subject":{"developerIdHash":"eaed488dac37a20eeadce46717abb4d78655633b3ffd07af79d532c4ce47185a"},"verifier":{"name":"m4-offchain-verifier","sourceSha256":"b4e8171dfe228aec96c8e67de526f037af253bc85bd502cc6bc5c96991aedb19","version":"1.0.0"},"window":{"analysisSet":"primary","ancestryVerified":true,"durationSeconds":5957933,"fromCommitHash":"a5ff7ac3bbb8659e2ec3ed41dd43889f06a7d7bc","fromTag":"2.4.0","revisionExpression":"a5ff7ac3bbb8659e2ec3ed41dd43889f06a7d7bc..aaab4eccc10c965897540b21e15f11859d0b62e7","toCommitHash":"aaab4eccc10c965897540b21e15f11859d0b62e7","toTag":"2.5.0","windowId":"urllib3_W03"}}